kd	vaggacode	bmc_chapter	vagga	vincode	pts_ref	bod_pages	pali_name	english_name	main_theme	subtopic	summary	rules_prohibitions	allowances	sc_brahmali	sc_horner
KD20	CV10		Culavagga	VIN-CV20.23	Vin.2.278–279	BD.5.384–386	Bhikkhunikkhandhaka	Nuns	Daily Life	Forest/Alone	Safety rules: no forest dwelling, no living alone.	Monks, nuns should not stay in a forest.	I allow her, monks, to look after him (her child) until he attains to years of discretion; I allow them, monks, having agreed upon one nun, to give her to that nun as a companion.	suttacentral.net/brahmali/kd20	suttacentral.net/horner/kd20
KD20	CV10		Culavagga	VIN-CV20.23	Cv.X.21, 23	BMC II Ch23	Bhikkhunikkhandhaka	Nuns	Requisites	Lodgings/Vehicles	Safety and etiquette rules regarding nuns' travel and dwellings.	A bhikkhuni should not live in a forest... should not ride in a vehicle (unless ill).	Allowed: A temporary lodging for bhikkhunis... a vehicle for the sick.	suttacentral.net/brahmali/kd20	suttacentral.net/horner/kd20
KD20	CV10		Culavagga	VIN-CV20.26	Vin.2.279–280	BD.5.386–387	Bhikkhunikkhandhaka	Nuns	Ordination	Re-ordination	One chance only for nuns who leave for other sects.	(None explicit in this section)	Monks, whatever nun, wearing the saffron robes, goes over to the fold of a sect, on coming back should not be ordained.	suttacentral.net/brahmali/kd20	suttacentral.net/horner/kd20
KD20	CV10		Culavagga	VIN-CV20.27	Vin.2.280–281	BD.5.388–389	Bhikkhunikkhandhaka	Nuns	Daily Life	Bathing	Bathing rules for nuns.	Monks, nuns should not bathe with chunam... should not bathe with scented clay... should not bathe in a bathroom (sauna)... should not bathe at a ford for men.	I allow them, monks, the red powder of rice husks and clay... ordinary clay... to bathe at a ford for women.	suttacentral.net/brahmali/kd20	suttacentral.net/horner/kd20
KD20	CV10		Culavagga	VIN-CV20.3	Vin.2.258	BD.5.357–358	Bhikkhunikkhandhaka	Nuns	Conduct	Greeting	Monks do not bow to nuns.	Monks, one should not carry out greeting, rising up for salutation and proper duties towards women. Whoever should carry out (one of these), there is an offence of wrong-doing.	(None explicit in this section)	suttacentral.net/brahmali/kd20	suttacentral.net/horner/kd20
KD20	CV10		Culavagga	VIN-CV20.3	Cv.X.3, 6	BMC II Ch23	Bhikkhunikkhandhaka	Nuns	Conduct	Interaction	Rules defining the hierarchy: monks do not perform formal acts of respect to nuns.	A bhikkhu should not bow down to a woman (bhikkhuni).	Allowed: To recite the Patimokkha to bhikkhunis (later amended to bhikkhunis reciting it themselves).	suttacentral.net/brahmali/kd20	suttacentral.net/horner/kd20
KD20	CV10		Culavagga	VIN-CV20.4	Vin.2.258	BD.5.358–359	Bhikkhunikkhandhaka	Nuns	Training	Training	Nuns follow monks' training where shared.	(None explicit in this section)	Those rules of training for nuns, Gotami, which are in common with those for monks, as the monks train themselves, so should you train yourselves...	suttacentral.net/brahmali/kd20	suttacentral.net/horner/kd20
KD20	CV10		Culavagga	VIN-CV20.5	Vin.2.258–259	BD.5.359	Bhikkhunikkhandhaka	Nuns	Training	Dhamma in brief	Criteria for determining true Dhamma.	(None explicit in this section)	Whatever are the states... (that) lead to passionlessness... you should know definitely, Gotami: this is dhamma.	suttacentral.net/brahmali/kd20	suttacentral.net/horner/kd20
KD20	CV10		Culavagga	VIN-CV20.6	Vin.2.259–260	BD.5.359–361	Bhikkhunikkhandhaka	Nuns	Conduct	Recitation/Confession	Nuns manage their own Pātimokkha and confession.	Monks, the Pātimokkha should not be recited to nuns by monks... Monks, an offence should not be not confessed by a nun... Monks, nuns’ offences should not be acknowledged by monks.	I allow, monks, the Pātimokkha to be recited to nuns by nuns; I allow, monks, nuns’ offences to be acknowledged by nuns.	suttacentral.net/brahmali/kd20	suttacentral.net/horner/kd20
KD20	CV10		Culavagga	VIN-CV20.6.3	Vin.2.260	BD.5.361	Bhikkhunikkhandhaka	Nuns	Conduct	Legal Acts	Nuns manage their own legal acts.	Monks, a (formal) act on behalf of nuns should not be carried out by monks.	I allow, monks, nuns to carry out (formal) acts on behalf of the nuns.	suttacentral.net/brahmali/kd20	suttacentral.net/horner/kd20
KD20	CV10		Culavagga	VIN-CV20.7	Vin.2.261	BD.5.362	Bhikkhunikkhandhaka	Nuns	Conduct	Disputes	Monks assist in settling nuns' disputes.	(None explicit in this section)	I allow you, monks, to settle nuns’ legal questions by monks.	suttacentral.net/brahmali/kd20	suttacentral.net/horner/kd20
KD20	CV10		Culavagga	VIN-CV20.8	Vin.2.261	BD.5.362–363	Bhikkhunikkhandhaka	Nuns	Conduct	Education	Monks teach Vinaya to nuns.	(None explicit in this section)	I allow, monks, discipline to be taught to nuns by monks.	suttacentral.net/brahmali/kd20	suttacentral.net/horner/kd20
KD20	CV10		Culavagga	VIN-CV20.9	Vin.2.262–266	BD.5.363–368	Bhikkhunikkhandhaka	Nuns	Penalties	Abuse/Exhortation	Penalties for harassment; Exhortation procedure.	Monks, nuns should not be sprinkled with muddy water by monks... Monks, a monk... should not show (body parts) to nuns... Monks, the entire Order of nuns should not go for exhortation.	I allow you, monks, to inflict a penalty on that monk (making him not to be greeted); I allow, monks, two or three nuns to go (together) for exhortation.	suttacentral.net/brahmali/kd20	suttacentral.net/horner/kd20
KD20	CV10		Culavagga	VIN-CV20.9	Cv.X.9	BMC II Ch23	Bhikkhunikkhandhaka	Nuns	Conduct	Exhortation (Ovada)	Procedure for the fortnightly instruction of nuns by monks.	The whole Community of Bhikkhunis should not go for the exhortation.	Allowed: 2 or 3 bhikkhunis to go to receive the exhortation (from the monks).	suttacentral.net/brahmali/kd20	suttacentral.net/horner/kd20
KD21	CV11		Culavagga	VIN-CV21.1	Cv.XI.1	Intro	Pañcasatikakkhandhaka	First Council	History	The Council	Mahakassapa convenes 500 Arahants to recite the texts; Upali recites Vinaya, Ananda recites Dhamma.	(None explicit)	(The Elders agree to chant the Dhamma and Vinaya at Rajagaha).	suttacentral.net/brahmali/kd21	suttacentral.net/horner/kd21
KD21	CV11		Culavagga	VIN-CV21.1.12	Vin.2.290	BD.5.402	Pañcasatikakkhandhaka	First Council	History	Channa's Penalty	Penalty for the obstinate monk Channa.	(None explicit in this section)	Ānanda, Channa may say whatever he likes to monks, but the monk Channa must neither be spoken to, nor exhorted nor instructed by monks (Brahmadanda).	suttacentral.net/brahmali/kd21	suttacentral.net/horner/kd21
KD21	CV11		Culavagga	VIN-CV21.1.12	Cv.XI.12	BMC II Ch12	Pañcasatikakkhandhaka	First Council	History	Channa's Penalty	Channa is completely ignored (silent treatment) until he reforms (which he does).	(None explicit)	Let the Community impose the brahma-penalty on the bhikkhu Channa.	suttacentral.net/brahmali/kd21	suttacentral.net/horner/kd21
KD21	CV11		Culavagga	VIN-CV21.1.4	Vin.2.285–286	BD.5.395	Pañcasatikakkhandhaka	First Council	History	Convening	Selection of 500 Arahants.	(None explicit in this section)	If it seems right to the Order, the Order may agree upon these five hundred monks to chant dhamma and discipline while they are spending the rains in Rājagaha.	suttacentral.net/brahmali/kd21	suttacentral.net/horner/kd21
KD21	CV11		Culavagga	VIN-CV21.1.9	Vin.2.287–288	BD.5.398–400	Pañcasatikakkhandhaka	First Council	History	Minor Rules	Resolution to keep all rules.	The Order is not laying down what has not been laid down, nor is it abolishing what has been laid down. It is proceeding in conformity with and according to the rules of training that have been laid down.	(None explicit in this section)	suttacentral.net/brahmali/kd21	suttacentral.net/horner/kd21
KD21	CV11		Culavagga	VIN-CV21.1.9	Cv.XI.9	BMC II Intro	Pañcasatikakkhandhaka	First Council	History	Minor Rules	The decision to keep all rules, even the "lesser and minor" ones, to prevent decay of the Dhamma.	(None explicit)	The Community should not lay down what has not been laid down, nor abolish what has been laid down.	suttacentral.net/brahmali/kd21	suttacentral.net/horner/kd21
KD22	CV12		Culavagga	VIN-CV22.1	Vin.2.294	BD.5.407–408	Sattasatikakkhandhaka	Second Council	History	Ten Points	The 10 indulgences of Vajjian monks.	(None explicit in this section)	(Yasa's rejection of the 10 points: salt in horn, two fingers, etc.)	suttacentral.net/brahmali/kd22	suttacentral.net/horner/kd22
KD22	CV12		Culavagga	VIN-CV22.1	Cv.XII.1	BMC II Intro	Sattasatikakkhandhaka	Second Council	History	The 10 Points	The dispute over lax practices 100 years after the Buddha; resolved by a committee (Ubbahika).	(None explicit)	(The 700 Elders rule that the 10 practices of the Vajjian monks—e.g., handling money—are not allowable).	suttacentral.net/brahmali/kd22	suttacentral.net/horner/kd22
KD22	CV12		Culavagga	VIN-CV22.2.7	Vin.2.305	BD.5.424–425	Sattasatikakkhandhaka	Second Council	History	Settlement	Appointment of the jury of 8 elders.	(None explicit in this section)	If it seems right to the Order, the Order may agree upon the four monks from the East and the four monks from Pāvā to settle this legal question by means of a referendum.	suttacentral.net/brahmali/kd22	suttacentral.net/horner/kd22
KD22	CV12		Culavagga	VIN-CV22.2.8	Vin.2.306–307	BD.5.425–429	Sattasatikakkhandhaka	Second Council	History	Verdict	Final judgment on the 10 points.	(Sabbakamin declares each of the 10 points unallowable based on Suttavibhanga precedents).	(None explicit in this section)	suttacentral.net/brahmali/kd22	suttacentral.net/horner/kd22
KD3	MV3		Mahavagga	VIN-MV3.1	Vin.1.137–138	BD.4.183–185	Vassūpanāyikakkhandhaka	Rains Residence	Rains Retreat (Vassa)	Rains Retreat (Vassa)	Mandatory retreat during the monsoon season.	Monks, you should not not enter upon the rains.	I allow you, monks, to enter upon the rains.	suttacentral.net/brahmali/kd3	suttacentral.net/horner/kd3
KD3	MV3		Mahavagga	VIN-MV3.9	Vin.1.149–152	BD.4.198–202	Vassūpanāyikakkhandhaka	Rains Residence	Rains Retreat (Vassa)	Fear	Permission to move if the residence is dangerous or uninhabitable.		I allow you, monks, to go where it is comfortable.	suttacentral.net/brahmali/kd3	suttacentral.net/horner/kd3
KD3	MV3		Mahavagga	VIN-MV3.1	Vin.1.137–138	BD.4.183–185	Vassūpanāyikakkhandhaka	Rains Residence	Rains Retreat (Vassa)	Rains Retreat (Vassa)	The obligation to reside in one place for the three months of the rainy season.	A bhikkhu must enter the Rains in the earlier or later period. He cannot travel for more than 7 days (sattahakaraniya).	Allowed: To break the Rains without offense if there is danger to life or the holy life, or if the Sangha splits.	suttacentral.net/brahmali/kd3	suttacentral.net/horner/kd3
KD3	MV3		Mahavagga	VIN-MV3.9	Vin.1.149–152	BD.4.198–202	Vassūpanāyikakkhandhaka	Rains Residence	Rains Retreat (Vassa)	Rains Retreat (Vassa)	The obligation to reside in one place for the three months of the rainy season.	A bhikkhu must enter the Rains in the earlier or later period. He cannot travel for more than 7 days (sattahakaraniya).	Allowed: To break the Rains without offense if there is danger to life or the holy life, or if the Sangha splits.	suttacentral.net/brahmali/kd3	suttacentral.net/horner/kd3
KD4	MV4		Mahavagga	VIN-MV4.1	Vin.1.157–160	BD.4.208–213	Pavāraṇākkhandhaka	Invitation	Rains Retreat (Vassa)	Invitation	The ceremony ending the Rains where monks invite criticism.		I allow you, monks, to invite on the fourteenth or on the fifteenth.	suttacentral.net/brahmali/kd4	suttacentral.net/horner/kd4
KD4	MV4		Mahavagga	VIN-MV4.1	Vin.1.157–160	BD.4.208–213	Pavāraṇākkhandhaka	Invitation	Rains Retreat (Vassa)	Invitation (Pavarana)	The ceremony at the end of the Rains where monks invite others to point out their faults.	Must be held on the 14th or 15th day. Replaces the Uposatha for that day.	Allowed: To postpone Pavarana if there is a desire to extend the Rains period (Komudi).	suttacentral.net/brahmali/kd4	suttacentral.net/horner/kd4
KD5	MV5		Mahavagga	VIN-MV5.1	Vin.1.185–187	BD.4.245–247	Cammakkhandhaka	Hides	Footwear	Footwear	Restrictions on luxury footwear.	Monks, double-soled sandals should not be worn.	I allow you, monks, sandals with a single sole.	suttacentral.net/brahmali/kd5	suttacentral.net/horner/kd5
KD5	MV5		Mahavagga	VIN-MV5.2	Vin.1.187–189	BD.4.247–249	Cammakkhandhaka	Hides	Footwear	Footwear	Prohibiting decorative or colored shoes.	Monks, all blue ... yellow ... red ... sandals should not be worn.		suttacentral.net/brahmali/kd5	suttacentral.net/horner/kd5
KD5	MV5	Ch. 14	Mahavagga	VIN-MV5.4		BD.4.250	Cammakkhandhaka	Hides	Discipline	Travel	Etiquette regarding wearing shoes inside the monastery grounds.	Monks, you should not walk with sandals on in the monastery.		suttacentral.net/brahmali/kd5	suttacentral.net/horner/kd5
KD5	MV5	Ch. 14	Mahavagga	VIN-MV5.1	Vin.1.185–187	BD.4.245–247	Cammakkhandhaka	Hides	Footwear	Footwear	Regulations regarding leather goods, sandals, and footwear.	Fancy footwear, shoes covering the ankles/toes, and multi-layered soles are forbidden.	Allowed: Simple sandals with single soles; Multi-layered soles allowed in border countries (like Avanti).	suttacentral.net/brahmali/kd5	suttacentral.net/horner/kd5
KD5	MV5	Ch. 14	Mahavagga	VIN-MV5.2	Vin.1.187–189	BD.4.247–249	Cammakkhandhaka	Hides	Footwear	Footwear	Regulations regarding leather goods, sandals, and footwear.	Fancy footwear, shoes covering the ankles/toes, and multi-layered soles are forbidden.	Allowed: Simple sandals with single soles; Multi-layered soles allowed in border countries (like Avanti).	suttacentral.net/brahmali/kd5	suttacentral.net/horner/kd5
KD5	MV5	Ch. 14	Mahavagga	VIN-MV5.4		BD.4.250	Cammakkhandhaka	Hides	Footwear	Footwear	Regulations regarding leather goods, sandals, and footwear.	Fancy footwear, shoes covering the ankles/toes, and multi-layered soles are forbidden.	Allowed: Simple sandals with single soles; Multi-layered soles allowed in border countries (like Avanti).	suttacentral.net/brahmali/kd5	suttacentral.net/horner/kd5
KD6	MV6	Ch. 14	Mahavagga	VIN-MV6.1	Vin.1.199–200	BD.4.269–271	Bhesajjakkhandhaka	Medicines	Medicines	5 Tonics	Allowance for ghee, butter, oil, honey, and molasses for the sick.		I allow, monks, to the monks who are ill the five medicines...	suttacentral.net/brahmali/kd6	suttacentral.net/horner/kd6
KD6	MV6	Ch. 14	Mahavagga	VIN-MV6.2	Vin.1.200–201	BD.4.271–272	Bhesajjakkhandhaka	Medicines	Medicines	Human flesh	Specific animal fats allowed for medicinal use.	Monks, you should not make use of human tallow.	I allow you, monks, the tallow of bears, fish, alligators, swine, donkeys.	suttacentral.net/brahmali/kd6	suttacentral.net/horner/kd6
KD6	MV6	Ch. 14	Mahavagga	VIN-MV6.3	Vin.1.201	BD.4.272–273	Bhesajjakkhandhaka	Medicines	Medicines	Medicines	List of permissible medicinal roots.		I allow you, monks, root medicine: turmeric, ginger, orris root...	suttacentral.net/brahmali/kd6	suttacentral.net/horner/kd6
KD6	MV6	Ch. 14	Mahavagga	VIN-MV6.8	Vin.1.202	BD.4.274	Bhesajjakkhandhaka	Medicines	Medicines	Medicines	List of permissible medicinal salts.		I allow you, monks, salt medicine...	suttacentral.net/brahmali/kd6	suttacentral.net/horner/kd6
KD6	MV6	Ch. 14	Mahavagga	VIN-MV6.9		BD.4.275	Bhesajjakkhandhaka	Medicines	Medicines	Medicines	Use of natural substances for medicine.		I allow you, monks, dung, urine, ashes, clay.	suttacentral.net/brahmali/kd6	suttacentral.net/horner/kd6
KD6	MV6	Ch. 14	Mahavagga	VIN-MV6.11	Vin.1.203	BD.4.275–276	Bhesajjakkhandhaka	Medicines	Medicines	Medicines	Treatment for eye diseases.		I allow you, monks, to anoint the eyes.	suttacentral.net/brahmali/kd6	suttacentral.net/horner/kd6
KD6	MV6	Ch. 14	Mahavagga	VIN-MV6.14	Vin.1.205–206	BD.4.278–281	Bhesajjakkhandhaka	Medicines	Medicines	Medicines	Medical massage/anointing.		I allow you, monks, to be anointed with oil.	suttacentral.net/brahmali/kd6	suttacentral.net/horner/kd6
KD6	MV6	Ch. 14	Mahavagga	VIN-MV6.22	Vin.1.215–216	BD.4.296	Bhesajjakkhandhaka	Medicines	Medicines	Surgery	Restrictions on surgery in sensitive areas; alternate cures.	Monks, you should not use surgical appliances within... private parts.	I allow you, monks, a mustard-plaster.	suttacentral.net/brahmali/kd6	suttacentral.net/horner/kd6
KD6	MV6	Ch. 14	Mahavagga	VIN-MV6.26	Vin.1.226	BD.4.303–304	Bhesajjakkhandhaka	Medicines	Medicines	5 Tonics	Allowance for sugar as a tonic.		I allow you, monks, raw sugar.	suttacentral.net/brahmali/kd6	suttacentral.net/horner/kd6
KD6	MV6	Ch. 14	Mahavagga	VIN-MV6.1	Vin.1.199–200	BD.4.269–271	Bhesajjakkhandhaka	Medicines	Medicines	5 Tonics	Allowances for medicines and dietary tonics for sick monks.	The five tonics (ghee, butter, oil, honey, molasses) can be stored for at most 7 days.	Allowed: Root medicine, salt medicine, chunam, raw sugar, surgical treatments (except near private parts).	suttacentral.net/brahmali/kd6	suttacentral.net/horner/kd6
KD6	MV6	Ch. 15	Mahavagga	VIN-CV6.2	Vin.1.200–201	BD.4.271–272	Bhesajjakkhandhaka	Medicines	Medicines	5 Tonics	Allowances for medicines and dietary tonics for sick monks.	The five tonics (ghee, butter, oil, honey, molasses) can be stored for at most 7 days.	Allowed: Root medicine, salt medicine, chunam, raw sugar, surgical treatments (except near private parts).	suttacentral.net/brahmali/kd6	suttacentral.net/horner/kd6
KD6	MV6	Ch. 15	Mahavagga	VIN-MV6.3	Vin.1.201	BD.4.272–273	Bhesajjakkhandhaka	Medicines	Medicines	5 Tonics	Allowances for medicines and dietary tonics for sick monks.	The five tonics (ghee, butter, oil, honey, molasses) can be stored for at most 7 days.	Allowed: Root medicine, salt medicine, chunam, raw sugar, surgical treatments (except near private parts).	suttacentral.net/brahmali/kd6	suttacentral.net/horner/kd6
KD6	MV6	Ch. 15	Mahavagga	VIN-MV6.8	Vin.1.202	BD.4.274	Bhesajjakkhandhaka	Medicines	Medicines	5 Tonics	Allowances for medicines and dietary tonics for sick monks.	The five tonics (ghee, butter, oil, honey, molasses) can be stored for at most 7 days.	Allowed: Root medicine, salt medicine, chunam, raw sugar, surgical treatments (except near private parts).	suttacentral.net/brahmali/kd6	suttacentral.net/horner/kd6
KD6	MV6	Ch. 15	Mahavagga	VIN-MV6.9		BD.4.275	Bhesajjakkhandhaka	Medicines	Medicines	5 Tonics	Allowances for medicines and dietary tonics for sick monks.	The five tonics (ghee, butter, oil, honey, molasses) can be stored for at most 7 days.	Allowed: Root medicine, salt medicine, chunam, raw sugar, surgical treatments (except near private parts).	suttacentral.net/brahmali/kd6	suttacentral.net/horner/kd6
KD6	MV6	Ch. 15	Mahavagga	VIN-MV6.11	Vin.1.203	BD.4.275–276	Bhesajjakkhandhaka	Medicines	Medicines	5 Tonics	Allowances for medicines and dietary tonics for sick monks.	The five tonics (ghee, butter, oil, honey, molasses) can be stored for at most 7 days.	Allowed: Root medicine, salt medicine, chunam, raw sugar, surgical treatments (except near private parts).	suttacentral.net/brahmali/kd6	suttacentral.net/horner/kd6
KD6	MV6	Ch. 15	Mahavagga	VIN-MV6.14	Vin.1.205–206	BD.4.278–281	Bhesajjakkhandhaka	Medicines	Medicines	5 Tonics	Allowances for medicines and dietary tonics for sick monks.	The five tonics (ghee, butter, oil, honey, molasses) can be stored for at most 7 days.	Allowed: Root medicine, salt medicine, chunam, raw sugar, surgical treatments (except near private parts).	suttacentral.net/brahmali/kd6	suttacentral.net/horner/kd6
KD6	MV6	Ch. 16	Mahavagga	VIN-MV6.22	Vin.1.215–216	BD.4.296	Bhesajjakkhandhaka	Medicines	Medicines	5 Tonics	Allowances for medicines and dietary tonics for sick monks.	The five tonics (ghee, butter, oil, honey, molasses) can be stored for at most 7 days.	Allowed: Root medicine, salt medicine, chunam, raw sugar, surgical treatments (except near private parts).	suttacentral.net/brahmali/kd6	suttacentral.net/horner/kd6
KD6	MV6	Ch. 16	Mahavagga	VIN-MV6.26	Vin.1.226	BD.4.303–304	Bhesajjakkhandhaka	Medicines	Medicines	5 Tonics	Allowances for medicines and dietary tonics for sick monks.	The five tonics (ghee, butter, oil, honey, molasses) can be stored for at most 7 days.	Allowed: Root medicine, salt medicine, chunam, raw sugar, surgical treatments (except near private parts).	suttacentral.net/brahmali/kd6	suttacentral.net/horner/kd6
KD7	MV7	Ch. 16	Mahavagga	VIN-MV7.1	Vin.1.253–254	BD.4.351–353	Kaṭhinakkhandhaka	Kathina	Robes	Kathina Allowance	The story of the 30 Paveyyaka monks; the Buddha allows the Kathina ceremony to provide extra comfort (five privileges) for monks who finished the Vassa.		I allow you, monks, when the monks have completed the rains-residence, to spread the Kathina.	suttacentral.net/brahmali/kd7	suttacentral.net/horner/kd7
KD7	MV7	Ch. 5	Mahavagga	VIN-MV7.1	Vin.1.254	BD.4.352	Kaṭhinakkhandhaka	Kathina	Robes	Privileges	The specific five relaxations of discipline granted to monks who participate in the Kathina.		Five things are allowable to you: going to families (without asking), wandering without the complete set of robes, a group meal, as many robes as you require, the robe-material is yours.	suttacentral.net/brahmali/kd7	suttacentral.net/horner/kd7
KD7	MV7	Ch. 5	Mahavagga	VIN-MV7.1	Vin.1.254–255	BD.4.353–355	Kaṭhinakkhandhaka	Kathina	Robes	Procedure	The formal procedure (Sanghakamma) for assigning and spreading the Kathina cloth.		I allow you, monks, to spread the Kathina. And thus, monks, should it be spread... (Formal act of spreading).	suttacentral.net/brahmali/kd7	suttacentral.net/horner/kd7
KD7	MV7	Ch. 5	Mahavagga	VIN-MV7.2	Vin.1.255–256	BD.4.356–358	Kaṭhinakkhandhaka	Kathina	Robes	Validity	Technical definitions of what counts as a valid Kathina (e.g., it must be made in a day, not just signed or dyed).	(Detailed matrix of valid vs invalid Kathina spreading).		suttacentral.net/brahmali/kd7	suttacentral.net/horner/kd7
KD7	MV7	Ch. 4	Mahavagga	VIN-MV7.12	Vin.1.264–265	BD.4.374–379	Kaṭhinakkhandhaka	Kathina	Robes	Removal (Palibodha)	Defines when the Kathina privileges end (suspension of the privileges), usually based on the monk leaving the monastery or the robe being finished/lost.		(The two impediments for the Kathina privileges: the residence and the robe).	suttacentral.net/brahmali/kd7	suttacentral.net/horner/kd7
KD7	MV7	Ch. 4	Mahavagga	VIN-MV7.1	Vin.1.253–254	BD.4.351–353	Kaṭhinakkhandhaka	Kathina	Robes	Kathina	The ceremony of making and offering the Kathina robe after the Rains.	The cloth must be made into a robe on the same day. The privileges last until the robe is settled or winter ends.	Allowed: Five privileges (e.g., group meals, leaving without a complete set of robes) for monks who participate.	suttacentral.net/brahmali/kd7	suttacentral.net/horner/kd7
KD7	MV7	Ch. 4	Mahavagga	VIN-MV7.1	Vin.1.254	BD.4.352	Kaṭhinakkhandhaka	Kathina	Robes	Kathina	The ceremony of making and offering the Kathina robe after the Rains.	The cloth must be made into a robe on the same day. The privileges last until the robe is settled or winter ends.	Allowed: Five privileges (e.g., group meals, leaving without a complete set of robes) for monks who participate.	suttacentral.net/brahmali/kd7	suttacentral.net/horner/kd7
KD7	MV7	Ch. 4	Mahavagga	VIN-MV7.1	Vin.1.254–255	BD.4.353–355	Kaṭhinakkhandhaka	Kathina	Robes	Kathina	The ceremony of making and offering the Kathina robe after the Rains.	The cloth must be made into a robe on the same day. The privileges last until the robe is settled or winter ends.	Allowed: Five privileges (e.g., group meals, leaving without a complete set of robes) for monks who participate.	suttacentral.net/brahmali/kd7	suttacentral.net/horner/kd7
KD7	MV7	Ch. 4	Mahavagga	VIN-MV7.2	Vin.1.255–256	BD.4.356–358	Kaṭhinakkhandhaka	Kathina	Robes	Kathina	The ceremony of making and offering the Kathina robe after the Rains.	The cloth must be made into a robe on the same day. The privileges last until the robe is settled or winter ends.	Allowed: Five privileges (e.g., group meals, leaving without a complete set of robes) for monks who participate.	suttacentral.net/brahmali/kd7	suttacentral.net/horner/kd7
KD7	MV7	Ch. 4	Mahavagga	VIN-MV7.12	Vin.1.264–265	BD.4.374–379	Kaṭhinakkhandhaka	Kathina	Robes	Kathina	The ceremony of making and offering the Kathina robe after the Rains.	The cloth must be made into a robe on the same day. The privileges last until the robe is settled or winter ends.	Allowed: Five privileges (e.g., group meals, leaving without a complete set of robes) for monks who participate.	suttacentral.net/brahmali/kd7	suttacentral.net/horner/kd7
KD8	MV8	Ch. 4	Mahavagga	VIN-MV8.2	Vin.1.268–269	BD.4.380–382	Cīvarakkhandhaka	Robes	Robes	Silk/Wool	Regulations on acceptable materials and colors for robes.	Monks, you should not wear robes that are all blue... all yellow...	I allow you, monks, six (kinds of) robe-material: linen, cotton, silk...	suttacentral.net/brahmali/kd8	suttacentral.net/horner/kd8
KD8	MV8	Ch. 4	Mahavagga	VIN-MV8.4	Vin.1.269	BD.4.382	Cīvarakkhandhaka	Robes	Robes	Acceptance of robes	Permission to accept cloth from lay supporters.		I allow you, monks, to accept robe-material.	suttacentral.net/brahmali/kd8	suttacentral.net/horner/kd8
KD8	MV8	Ch. 4	Mahavagga	VIN-MV8.5	Vin.1.269–272	BD.4.382–387	Cīvarakkhandhaka	Robes	Robes	Laying aside	Establishing storage and processing areas for cloth.		I allow you, monks, to agree upon a dye-house and a store-room...	suttacentral.net/brahmali/kd8	suttacentral.net/horner/kd8
KD8	MV8	Ch. 17	Mahavagga	VIN-MV8.10	Vin.1.274–276	BD.4.397–401	Cīvarakkhandhaka	Robes	Robes	Dying/Boiling	Permitted natural dyes and dyeing methods.	Monks, you should not boil dye with cow-dung...	I allow you, monks, six (kinds of) dyes: dye from roots, stems...	suttacentral.net/brahmali/kd8	suttacentral.net/horner/kd8
