kd	vaggacode	bmc_chapter	vagga	vincode	pts_ref	bod_pages	pali_name	english_name	main_theme	subtopic	summary	rules_prohibitions	allowances	sc_brahmali	sc_horner
KD14	CV4		Culavagga	VIN-CV14.5	Cv.IV.5	BMC II Ch11	Samathakkhandhaka	Settling Issues	Legal Acts	Past Insanity (Amulha)	Absolving a monk of offenses committed during a period of mental illness.	(None explicit)	Allowed: To give a verdict of past insanity to a bhikkhu who committed offenses while insane but is now cured.	suttacentral.net/brahmali/kd14	suttacentral.net/horner/kd14
KD14	CV4		Culavagga	VIN-CV14.7	Vin.2.83–84	BD.5.109–110	Samathakkhandhaka	Settlements	Dispute Resolution	Acknowledgement (Confession)	Requirement for confession for a valid legal act.	Monks, a (formal) act... should not be carried out against a monk without his acknowledgement. Whoever should (so) carry (one) out, there is an offence of wrong-doing.	(None explicit in this section)	suttacentral.net/brahmali/kd14	suttacentral.net/horner/kd14
KD14	CV4		Culavagga	VIN-CV14.9	Vin.2.84–85	BD.5.111	Samathakkhandhaka	Settlements	Dispute Resolution	Majority Decision (Voting)	Using voting tickets (salaka) when unanimity fails.	(None explicit in this section)	I allow you monks, to settle this kind of legal question by the decision of the majority; A monk possessed of five qualities should be agreed upon as distributor of (voting) tickets.	suttacentral.net/brahmali/kd14	suttacentral.net/horner/kd14
KD15	CV5		Culavagga	VIN-CV15.1	Cv.V.1	BMC II Ch1	Khuddakakkhandhaka	Miscellany	Grooming	Bathing	Prohibition on sensual rubbing against trees or using luxury bath tools; simple hand rubbing allowed.	A bhikkhu bathing should not rub his body against a tree. It is an offense of wrong doing.	Allowed: To use the hand (to rub the body).	suttacentral.net/brahmali/kd15	suttacentral.net/horner/kd15
KD15	CV5		Culavagga	VIN-CV15.1.1	Vin.2.105	BD.5.141	Khuddakakkhandhaka	Minor Matters	Grooming	Bathing	Prohibition on sensual rubbing against trees.	Monks, while a monk is bathing he should not rub his body against a tree. Whoever should (so) rub it, there is an offence of wrong-doing.	(None explicit in this section)	suttacentral.net/brahmali/kd15	suttacentral.net/horner/kd15
KD15	CV5		Culavagga	VIN-CV15.1.3	Vin.2.106	BD.5.142–143	Khuddakakkhandhaka	Minor Matters	Grooming	Bathing	Prohibition on bath tools; allowance for sick.	Monks, you should not bathe on a rubbing-board. Whoever should (so) bathe, there is an offence of wrong-doing; Monks, you should not bathe using a scrubber.	I allow, monks, one who is ill (to use) an unshaped scrubber.	suttacentral.net/brahmali/kd15	suttacentral.net/horner/kd15
KD15	CV5		Culavagga	VIN-CV15.10	Vin.2.115	BD.5.156	Khuddakakkhandhaka	Minor Matters	Requisites	Improper Bowls	Prohibition on skull/gourd bowls.	Monks, you should not go about for almsfood (to be put) into a gourd... into a water-pot... a bowl made from a skull should not be carried.	I allow you, monks, a waste-tub.	suttacentral.net/brahmali/kd15	suttacentral.net/horner/kd15
KD15	CV5		Culavagga	VIN-CV15.11	Vin.2.115–118	BD.5.156–161	Khuddakakkhandhaka	Minor Matters	Requisites	Sewing/Kathina	Allowances for sewing tools and Kathina frames.	Monks, various kinds of small knives with handles should not be used... various kinds of thimbles should not be used.	I allow you, monks, a needle... a tube for (holding) the needles... a kaṭhina-frame... a thimble.	suttacentral.net/brahmali/kd15	suttacentral.net/horner/kd15
KD15	CV5		Culavagga	VIN-CV15.12	Vin.2.118	BD.5.161–162	Khuddakakkhandhaka	Minor Matters	Requisites	Bags/Sandals	Allowances for bags.	(None explicit in this section)	I allow you, monks, a bag for medicine... a bag for sandals.	suttacentral.net/brahmali/kd15	suttacentral.net/horner/kd15
KD15	CV5		Culavagga	VIN-CV15.13	Vin.2.118–119	BD.5.162–163	Khuddakakkhandhaka	Minor Matters	Requisites	Water Strainers	Mandatory water strainer rule.	Monks, you should not go along a highway without a strainer. Whoever should (so) go, there is an offence of wrong-doing.	I allow, monks, a strainer... a regulation waterpot... a double water-strainer... a filter.	suttacentral.net/brahmali/kd15	suttacentral.net/horner/kd15
KD15	CV5		Culavagga	VIN-CV15.13	Cv.V.13	BMC II Ch3	Khuddakakkhandhaka	Miscellany	Requisites	Water Strainers	Mandatory use of water strainers to prevent killing small water-borne creatures.	A bhikkhu is not to travel on a road without a water strainer.	Allowed: A strainer, a ladle-strainer, a filter box... or (in absence) to determine a corner of the robe.	suttacentral.net/brahmali/kd15	suttacentral.net/horner/kd15
KD15	CV5		Culavagga	VIN-CV15.14	Vin.2.119–121	BD.5.163–167	Khuddakakkhandhaka	Minor Matters	Lodgings	Sauna/Latrine construction	Detailed construction allowances.	(None explicit in this section)	I allow, monks, a place for pacing up and down in, and a bathroom (sauna); I allow... a pipe for the steam... a chair for the bathroom... a privy... a cesspool... privy shoes.	suttacentral.net/brahmali/kd15	suttacentral.net/horner/kd15
KD15	CV5		Culavagga	VIN-CV15.14	Cv.V.14	BMC II Ch7	Khuddakakkhandhaka	Miscellany	Lodgings	Toilet Construction	Detailed engineering allowances for building sanitary toilets (vacca-kuti).	(None explicit)	Allowed: A privy, a cesspool, a floor of brick/stone/wood, a roof, a door...	suttacentral.net/brahmali/kd15	suttacentral.net/horner/kd15
KD15	CV5		Culavagga	VIN-CV15.15	Vin.2.121	BD.5.167	Khuddakakkhandhaka	Minor Matters	Etiquette	Nudity	Prohibition on public nudity.	Monks, one who is naked should neither greet nor be greeted by one who is naked... one who is naked should not drink (etc). Whoever should (so) drink, there is an offence of wrong-doing.	(None explicit in this section)	suttacentral.net/brahmali/kd15	suttacentral.net/horner/kd15
KD15	CV5		Culavagga	VIN-CV15.15	Cv.V.12*	BMC II Ch2	Khuddakakkhandhaka	Miscellany	Etiquette	Shoes	(*Note: Shoe rules appear in Mv.V but are refined in Cv protocols). General ban on footwear indoors/in monasteries.	A bhikkhu should not wear shoes in the monastery (unless ill).	Allowed: To wear shoes in the monastery if one's feet are split or if ill.	suttacentral.net/brahmali/kd15	suttacentral.net/horner/kd15
KD15	CV5		Culavagga	VIN-CV15.16	Vin.2.122–123	BD.5.167–170	Khuddakakkhandhaka	Minor Matters	Lodgings	Wells/Tanks	Allowances for water infrastructure.	(None explicit in this section)	I allow, monks, a well... a cord for drawing water... a tank... a bathroom with a curving roof.	suttacentral.net/brahmali/kd15	suttacentral.net/horner/kd15
KD15	CV5		Culavagga	VIN-CV15.18	Vin.2.123	BD.5.170	Khuddakakkhandhaka	Minor Matters	Furniture	Beds/Chairs	Rules on mats and flowers.	Monks, you should not be away, separated from your pieces of cloth to sit upon for four months... you should not lie down to sleep on beds scattered over with flowers.	I allow you, monks, having taken the scents, to give the five-finger mark on the door.	suttacentral.net/brahmali/kd15	suttacentral.net/horner/kd15
KD15	CV5		Culavagga	VIN-CV15.19	Vin.2.123–124	BD.5.170–171	Khuddakakkhandhaka	Minor Matters	Food	Eating Etiquette	Prohibition on luxurious/shared eating arrangements.	Monks, you should not eat (leaning against) chased cushions... you should not eat from one dish nor drink from one beaker nor share one couch...	I allow, monks, a stand (for the bowl).	suttacentral.net/brahmali/kd15	suttacentral.net/horner/kd15
KD15	CV5		Culavagga	VIN-CV15.2	Cv.V.2	BMC II Ch1	Khuddakakkhandhaka	Miscellany	Grooming	Hair	Standardizing the maximum length of hair for monks.	Long hair should not be worn. It is an offense of wrong doing.	Allowed: Hair of two months' growth or two fingerbreadths in length.	suttacentral.net/brahmali/kd15	suttacentral.net/horner/kd15
KD15	CV5		Culavagga	VIN-CV15.2.1	Vin.2.106	BD.5.143–144	Khuddakakkhandhaka	Minor Matters	Dress	Ornaments	Prohibition on jewelry.	Monks, ear ornaments should not be worn, chains... bangles... armlets... bracelets... finger rings should not be worn. Whoever should wear (any of these things), there is an offence of wrong-doing.	(None explicit in this section)	suttacentral.net/brahmali/kd15	suttacentral.net/horner/kd15
KD15	CV5		Culavagga	VIN-CV15.2.2	Vin.2.106–107	BD.5.144	Khuddakakkhandhaka	Minor Matters	Dress	Hair length	Maximum hair length rules.	Monks, long hair should not be worn. Whoever should wear it (long), there is an offence of wrong-doing.	I allow it to be of a two months’ growth or two finger-breadths (in length).	suttacentral.net/brahmali/kd15	suttacentral.net/horner/kd15
KD15	CV5		Culavagga	VIN-CV15.2.4	Vin.2.107	BD.5.144–145	Khuddakakkhandhaka	Minor Matters	Dress	Mirrors/Ointments	Prohibition on vanity; allowances for medical needs.	Monks, a mark on the face should not be examined in a mirror or in a water-bowl. Whoever should (so) examine it, there is an offence of wrong-doing; Monks, the face should not be anointed.	I allow you, monks, on account of a disease, to examine a mark on the face in a mirror or in a water-bowl; I allow you, monks, on account of disease, to anoint the face.	suttacentral.net/brahmali/kd15	suttacentral.net/horner/kd15
KD15	CV5		Culavagga	VIN-CV15.2.6	Vin.2.107	BD.5.145	Khuddakakkhandhaka	Minor Matters	Conduct	Dancing/Music	Prohibition on entertainment.	Monks, you should not go to see dancing or singing or music. Whoever should go, there is an offence of wrong-doing.	(None explicit in this section)	suttacentral.net/brahmali/kd15	suttacentral.net/horner/kd15
KD15	CV5		Culavagga	VIN-CV15.20	Vin.2.124–127	BD.5.171–176	Khuddakakkhandhaka	Minor Matters	Discipline	Turning Bowl Upside Down (Vaddha)	Procedure for boycotting a layperson.	Monks, if a lay-follower is possessed of eight qualities his bowl may be turned upside down: if he tries for non-receiving (of gains) by monks...	I allow you, monks, to turn a lay-follower’s bowl upside down... I allow you, monks, to set upright a lay-follower’s bowl.	suttacentral.net/brahmali/kd15	suttacentral.net/horner/kd15
KD15	CV5		Culavagga	VIN-CV15.20	Cv.V.20	BMC II Ch12	Khuddakakkhandhaka	Miscellany	Discipline	Lay Boycott (Pattanikkujjana)	The formal act of boycotting a layperson (Vaddha) for slandering the Sangha.	(None explicit)	Allowed: To turn the bowl upside down (suspend relations) for a lay follower who brings loss to the Community... or speaks in dispraise of the Buddha, Dhamma, or Sangha.	suttacentral.net/brahmali/kd15	suttacentral.net/horner/kd15
KD15	CV5		Culavagga	VIN-CV15.21	Vin.2.127–129	BD.5.176–179	Khuddakakkhandhaka	Minor Matters	Etiquette	Treading on Cloth	Rule against walking on white cloth unless asked for blessings.	Monks, you should not tread on a cloth carpeting. Whoever should tread on one, there is an offence of wrong-doing.	I allow you, monks, when being asked by householders for good luck’s sake, to tread on a cloth carpeting.	suttacentral.net/brahmali/kd15	suttacentral.net/horner/kd15
KD15	CV5		Culavagga	VIN-CV15.22	Vin.2.129–130	BD.5.179–180	Khuddakakkhandhaka	Minor Matters	Requisites	Miscellaneous (Visakha)	Miscellaneous allowances.	Monks, you should not make use of a (clay foot-) scrubber.	I allow, monks, a little jar and a broom... a fan and a palmyra-whisk.	suttacentral.net/brahmali/kd15	suttacentral.net/horner/kd15
KD15	CV5		Culavagga	VIN-CV15.23	Vin.2.130–131	BD.5.180–181	Khuddakakkhandhaka	Minor Matters	Requisites	Fans/Sunshades	Rules on fans and sunshades.	Monks, a chowry-fan should not be used... Monks, a sunshade should not be used. Whoever should use one, there is an offence of wrong-doing.	I allow, monks, three (kinds of) fans... I allow, monks, a sunshade to be used in a monastery and monastery precincts both by one who is ill and by one who is not ill.	suttacentral.net/brahmali/kd15	suttacentral.net/horner/kd15
KD15	CV5		Culavagga	VIN-CV15.24	Vin.2.131–132	BD.5.181–183	Khuddakakkhandhaka	Minor Matters	Requisites	Walking staffs	Staffs allowed only for the sick.	Monks, a walking staff with string on it should not be carried.	I allow you, monks, to give an agreement as to a walking staff to a monk who is ill.	suttacentral.net/brahmali/kd15	suttacentral.net/horner/kd15
KD15	CV5		Culavagga	VIN-CV15.25	Vin.2.132	BD.5.183	Khuddakakkhandhaka	Minor Matters	Food	Rumination	Allowance for a specific monk; general prohibition on eating regurgitated food.	But, monks, one should not eat (anything), having brought it back from the mouth to outside of it.	I allow, monks, rumination for a ruminator.	suttacentral.net/brahmali/kd15	suttacentral.net/horner/kd15
KD15	CV5		Culavagga	VIN-CV15.27	Vin.2.133–135	BD.5.184–187	Khuddakakkhandhaka	Minor Matters	Grooming	Nails/Hair	Detailed grooming rules.	Monks, long nails should not be worn... you should not have your twenty (nails) polished... you should not have your beards trimmed... you should not have the hair of your bodies removed... you should not have grey hairs taken out.	I allow, monks, cutting of the nails... a razor, a whetstone... tweezers... an instrument for removing dirt from the ears.	suttacentral.net/brahmali/kd15	suttacentral.net/horner/kd15
KD15	CV5		Culavagga	VIN-CV15.27	Cv.V.27, 31	BMC II Ch1	Khuddakakkhandhaka	Miscellany	Grooming	Nails/Teeth	Hygiene rules for nails and teeth cleaning.	Long toenails/fingernails should not be worn... tooth-wood should not be chewed (too long).	Allowed: To cut nails down to the flesh... to chew tooth-wood (up to 8 fingerbreadths).	suttacentral.net/brahmali/kd15	suttacentral.net/horner/kd15
KD15	CV5		Culavagga	VIN-CV15.28	Vin.2.135–136	BD.5.187–188	Khuddakakkhandhaka	Minor Matters	Requisites	Hoarding/Cushions	Prohibition on hoarding metal; allowance for bandages.	Monks, a store of copper goods, of bronze goods should not be made... Monks, you should not sit down lolling on outer cloaks.	I allow, monks, a bandage... a loom.	suttacentral.net/brahmali/kd15	suttacentral.net/horner/kd15
KD15	CV5		Culavagga	VIN-CV15.29	Vin.2.136–137	BD.5.188–190	Khuddakakkhandhaka	Minor Matters	Dress	Waistbands/Buttons	Rules on belts and fasteners.	Monks, you should not enter a village without your waistband... various kinds of waistbands should not be worn... various kinds of buckles should not be worn.	I allow, monks, a waistband... a buckle.	suttacentral.net/brahmali/kd15	suttacentral.net/horner/kd15
KD15	CV5		Culavagga	VIN-CV15.3	Vin.2.108	BD.5.145–146	Khuddakakkhandhaka	Minor Matters	Chanting	Singing Dhamma	Prohibition on singing style; allowance for chanting.	Monks, dhamma should not be sung with a long-drawn plain-song sound. Whoever should (so) sing it, there is an offence of wrong-doing.	I allow intoning.	suttacentral.net/brahmali/kd15	suttacentral.net/horner/kd15
KD15	CV5		Culavagga	VIN-CV15.31	Vin.2.138	BD.5.192–193	Khuddakakkhandhaka	Minor Matters	Grooming	Nails/Teeth	Mandatory tooth cleaning stick.	Monks, there are these five disadvantages in not chewing tooth-wood... Monks, a long piece of tooth-wood should not be chewed.	I allow, monks, tooth-wood... to be eight finger breadths (in length) at the most.	suttacentral.net/brahmali/kd15	suttacentral.net/horner/kd15
KD15	CV5		Culavagga	VIN-CV15.32	Vin.2.138–139	BD.5.193	Khuddakakkhandhaka	Minor Matters	Conduct	Trees/Fire	Safety rules regarding fire and trees.	Monks, a forest should not be set on fire... Monks, a tree should not be climbed.	I allow you, monks, if a forest fire is burning, to make a counter-fire... to climb a tree to the height of a man, and as high as you like in cases of distress.	suttacentral.net/brahmali/kd15	suttacentral.net/horner/kd15
KD15	CV5		Culavagga	VIN-CV15.33	Vin.2.139	BD.5.193–194	Khuddakakkhandhaka	Minor Matters	Chanting	Dialect/Metre	Prohibition on Sanskrit verse; instruction to use one's own dialect.	Monks, the speech of the Awakened One should not be given in metrical form. Whoever should (so) give it, there is an offence of wrong-doing.	I allow you, monks, to learn the speech of the Awakened One according to his own dialect.	suttacentral.net/brahmali/kd15	suttacentral.net/horner/kd15
KD15	CV5		Culavagga	VIN-CV15.33.2	Vin.2.139–140	BD.5.194–195	Khuddakakkhandhaka	Minor Matters	Learning	Metaphysics/Worldly Knowledge	Prohibition on learning non-Buddhist arts (Lokayata).	Monks, metaphysics should not be learnt... Monks, worldly knowledge should not be learnt.	(None explicit in this section)	suttacentral.net/brahmali/kd15	suttacentral.net/horner/kd15
KD15	CV5		Culavagga	VIN-CV15.33.3	Vin.2.140	BD.5.195	Khuddakakkhandhaka	Minor Matters	Etiquette	Sneezing	Rules on responding to sneezes.	Monks, ‘Long life’ should not be said to one who has sneezed.	I allow you, monks, when (the phrase) ‘May you live (long), honoured sirs’ is being spoken to you by householders to say, ‘Long life’ (to them).	suttacentral.net/brahmali/kd15	suttacentral.net/horner/kd15
KD15	CV5		Culavagga	VIN-CV15.34	Vin.2.140	BD.5.195–196	Khuddakakkhandhaka	Minor Matters	Food	Garlic	Prohibition on garlic.	Monks, garlic should not be eaten. Whoever should eat it, there is an offence of wrong-doing.	I allow you, monks, to eat garlic in the case of illness.	suttacentral.net/brahmali/kd15	suttacentral.net/horner/kd15
KD15	CV5		Culavagga	VIN-CV15.35	Vin.2.141–142	BD.5.196–197	Khuddakakkhandhaka	Minor Matters	Bathroom	Toilet	Detailed rules for urinals and latrines.	(None explicit in this section)	I allow you monks, to relieve yourselves at one side... I allow you, monks, a vessel... urinal shoes.	suttacentral.net/brahmali/kd15	suttacentral.net/horner/kd15
KD15	CV5		Culavagga	VIN-CV15.37	Vin.2.143	BD.5.198	Khuddakakkhandhaka	Minor Matters	Requisites	Materials	General allowances for materials.	(None explicit in this section)	I allow, monks, all copper goods except a weapon; all wooden goods except a sofa, a divan, a wooden bowl, wooden shoes; all clay goods except a (clay-foot-) scrubber and a large earthen vessel.	suttacentral.net/brahmali/kd15	suttacentral.net/horner/kd15
KD15	CV5		Culavagga	VIN-CV15.4	Vin.2.108	BD.5.146	Khuddakakkhandhaka	Minor Matters	Dress	Wool	Prohibition on specific wool garments.	Monks, woollen clothes with the fleece outside should not be worn. Whoever should wear them, there is an offence of wrong-doing.	(None explicit in this section)	suttacentral.net/brahmali/kd15	suttacentral.net/horner/kd15
KD15	CV5		Culavagga	VIN-CV15.5	Vin.2.108–109	BD.5.146–147	Khuddakakkhandhaka	Minor Matters	Food	Fruit	Rules for making fruit allowable (kappiya).	Monks, mangoes should not be made use of. Whoever should make use of them, there is an offence of wrong-doing.	I allow you, monks, to make use of fruit that in five ways is allowable for recluses: if it is damaged by fire, damaged by a knife, damaged by (one’s) nail, if it is seedless, and the fifth is if the seeds are discharged.	suttacentral.net/brahmali/kd15	suttacentral.net/horner/kd15
KD15	CV5		Culavagga	VIN-CV15.5	Cv.V.5	BMC II Ch4	Khuddakakkhandhaka	Miscellany	Food	Fruit	Rules for "kappiya" (making fruit allowable) to distinguish monks from laypeople who harvest freely.	Mangoes should not be consumed (unless made allowable).	Allowed: To consume fruit made allowable in five ways: damaged by fire, knife, nail, seedless, or seeds removed.	suttacentral.net/brahmali/kd15	suttacentral.net/horner/kd15
KD15	CV5		Culavagga	VIN-CV15.6	Vin.2.109–110	BD.5.147–149	Khuddakakkhandhaka	Minor Matters	Medicines	Snake bite/Blood letting	Allowance for Paritta chanting and medical blood-letting.	(None explicit in this section)	I allow you... to make a charm for the self for self-protection (Paritta); I allow you, monks, to let blood.	suttacentral.net/brahmali/kd15	suttacentral.net/horner/kd15
KD15	CV5		Culavagga	VIN-CV15.7	Vin.2.110	BD.5.149	Khuddakakkhandhaka	Minor Matters	Discipline	Self-mutilation	Prohibition on castration.	Monks, one should not cut off one’s own male organ. Whoever should cut it off, there is a grave offence.	(None explicit in this section)	suttacentral.net/brahmali/kd15	suttacentral.net/horner/kd15
KD15	CV5		Culavagga	VIN-CV15.8	Cv.V.8	BMC II Ch3	Khuddakakkhandhaka	Miscellany	Requisites	Bowls	Prohibition on luxury (gold/silver) or wooden bowls; standardization of bowl materials.	A wooden bowl is not to be used. It is an offense of wrong doing.	Allowed: Two kinds of bowls: iron and clay.	suttacentral.net/brahmali/kd15	suttacentral.net/horner/kd15
KD15	CV5		Culavagga	VIN-CV15.8.2	Vin.2.112	BD.5.151–152	Khuddakakkhandhaka	Minor Matters	Discipline	Displaying miracles (Pindola)	Prohibition on showing off psychic powers (after Pindola levitated).	Monks, a condition of further-men, a wonder of psychic power is not to be exhibited to householders. Whoever should exhibit them, there is an offence of wrong-doing.	(None explicit in this section)	suttacentral.net/brahmali/kd15	suttacentral.net/horner/kd15
KD15	CV5		Culavagga	VIN-CV15.8.2	Vin.2.112	BD.5.152	Khuddakakkhandhaka	Minor Matters	Requisites	Bowls	Prohibition on expensive/wooden bowls.	Monks, a wooden bowl should not be used. Whoever should use one, there is an offence of wrong-doing; Monks, a bowl made of gold should not be used...	I allow you, monks, two (kinds of) bowls: an iron bowl, a clay bowl.	suttacentral.net/brahmali/kd15	suttacentral.net/horner/kd15
KD15	CV5		Culavagga	VIN-CV15.9	Cv.V.9	BMC II Ch3	Khuddakakkhandhaka	Miscellany	Requisites	Bowl Care	Practical rules to prevent rusting or breaking the alms bowl.	A bowl should not be left in the sun with water in it... should not be left on a hard surface.	Allowed: To dry the bowl in the sun for a short time... to use a bowl stand.	suttacentral.net/brahmali/kd15	suttacentral.net/horner/kd15
KD15	CV5		Culavagga	VIN-CV15.9.3	Vin.2.112–113	BD.5.153–154	Khuddakakkhandhaka	Minor Matters	Requisites	Bowl Care	Rules for washing and drying bowls.	Monks, a bowl should not be put away with water in it... A bowl should not be laid aside in the heat...	I allow you, monks, to put away a bowl having dried it in the sun.	suttacentral.net/brahmali/kd15	suttacentral.net/horner/kd15
KD15	CV5		Culavagga	VIN-CV15.9.4	Vin.2.113–115	BD.5.154–156	Khuddakakkhandhaka	Minor Matters	Requisites	Bowl Storage	Rules to prevent breaking bowls.	Monks, a bowl should not be laid aside at the edge of a solid bench... a bowl should not be hung up... should not be laid aside on a couch... on a lap... in a sunshade... a door should not be opened when one has a bowl in one’s hand.	I allow you, monks, a little prop for bowls; I allow you, monks, a bowl-stand... a bag for bowls... a strap at the edge, a thread for tying.	suttacentral.net/brahmali/kd15	suttacentral.net/horner/kd15
KD16	CV6		Culavagga	VIN-CV16.1	Vin.2.146–147	BD.5.204–205	Senāsanakkhandhaka	Lodgings	Dwellings	Allowance for Abodes	Initial allowance for built lodgings.	(None explicit in this section)	I allow, monks, five (kinds of) abodes: a dwelling-place, a curved house, a long house, a mansion, a cave.	suttacentral.net/brahmali/kd16	suttacentral.net/horner/kd16
KD16	CV6		Culavagga	VIN-CV16.1	Cv.VI.1	BMC II Ch6	Senāsanakkhandhaka	Lodgings	Dwellings	Five Abodes	The Buddha allows monks to use built lodgings (accepted from Anathapindika).	(None explicit)	Allowed: Five kinds of dwellings: a vihara, a curved house, a long house, a mansion, a cave.	suttacentral.net/brahmali/kd16	suttacentral.net/horner/kd16
KD16	CV6		Culavagga	VIN-CV16.10	Vin.2.165–166	BD.5.230–232	Senāsanakkhandhaka	Lodgings	Etiquette	Eating/Illness	Rules on displacing monks during meals or sickness.	Monks, a monk should not turn (another) away while a meal is yet unfinished... Monks, one who is ill should not be turned away... Monks, a lodging should not be reserved on (some slight) pretext.	I allow you, monks, to give a suitable sleeping place to one who is ill.	suttacentral.net/brahmali/kd16	suttacentral.net/horner/kd16
KD16	CV6		Culavagga	VIN-CV16.11	Vin.2.166–167	BD.5.232–234	Senāsanakkhandhaka	Lodgings	Administration	Assignment	Procedures for assigning rooms.	Monks, a monk should not be thrown out of a dwelling-place belonging to an Order by one who is angry, displeased.	I allow you, monks, to assign lodgings... I allow you, monks, to agree upon a monk... as assigner of lodgings.	suttacentral.net/brahmali/kd16	suttacentral.net/horner/kd16
KD16	CV6		Culavagga	VIN-CV16.11	Cv.VI.11, 21	BMC II Ch18	Senāsanakkhandhaka	Lodgings	Administration	Officials	Establishing Sangha officials to manage property fairness.	(None explicit)	Allowed: To appoint a lodging-assigner, a meals-distributor, a storekeeper, a robe-receiver...	suttacentral.net/brahmali/kd16	suttacentral.net/horner/kd16
KD16	CV6		Culavagga	VIN-CV16.12	Vin.2.168	BD.5.235–236	Senāsanakkhandhaka	Lodgings	Administration	Tenure	Limit on reserving rooms.	Monks, two (lodgings) should not be reserved by one (monk).	I allow you, monks, to reserve it for the three months of the rains but not to reserve it for the dry season.	suttacentral.net/brahmali/kd16	suttacentral.net/horner/kd16
KD16	CV6		Culavagga	VIN-CV16.13	Vin.2.168–169	BD.5.236–237	Senāsanakkhandhaka	Lodgings	Etiquette	Teaching/Seating	Etiquette for Dhamma teaching and seating.	(None explicit in this section)	I allow you, monks, when a newly ordained monk is reciting to sit down on a seat that is the same (height)... I allow you, monks, to sit down with those entitled to seats of an equal (height).	suttacentral.net/brahmali/kd16	suttacentral.net/horner/kd16
KD16	CV6		Culavagga	VIN-CV16.14	Cv.VI.14	BMC II Ch7	Senāsanakkhandhaka	Lodgings	Administration	Inalienable Goods	Prohibition on selling or giving away heavy assets like land, buildings, and furniture.	Heavy articles (garubhanda) belonging to the Community should not be disposed of. It is a Thullaccaya offense.	(None explicit)	suttacentral.net/brahmali/kd16	suttacentral.net/horner/kd16
